Symbol,Name,Last Sale,Net Change,% Change,Market Cap,Country,IPO Year,Volume,Sector,Industry
PFLT,PennantPark Floating Rate Capital Ltd. Common Stock,$11.49,0.07,0.613%,708104353.00,United States,2022,546621,Finance,Finance: Consumer Services
PFN,PIMCO Income Strategy Fund II,$7.22,0.04,0.557%,0.00,United States,2004,98207,Finance,Finance/Investors Services
PFO,Flaherty & Crumrine Preferred and Income Opportunity Fund Incorporated,$8.04,0.0042,0.052%,0.00,United States,1992,12377,Finance,Finance Companies
PFS,Provident Financial Services Inc Common Stock,$15.09,-0.11,-0.724%,1140826710.00,United States,2003,567207,Finance,Savings Institutions
PFSI,PennyMac Financial Services Inc. Common Stock,$87.00,0.80,0.928%,4387252443.00,United States,2013,487854,Finance,Finance: Consumer Services
PG,Procter & Gamble Company (The) Common Stock,$161.29,-1.26,-0.775%,380666219634.00,United States,,5659638,Consumer Discretionary,Package Goods/Cosmetics
PGP,Pimco Global StocksPlus & Income Fund Common Shares of Beneficial Interest,$7.42,0.06,0.815%,0.00,United States,2005,40276,Finance,Finance Companies
PGR,Progressive Corporation (The) Common Stock,$208.03,-2.04,-0.971%,121838482836.00,United States,,2628573,Finance,Property-Casualty Insurers
PGRE,Paramount Group Inc. Common Stock,$4.67,0.05,1.082%,1015099636.00,United States,2014,442656,Real Estate,Real Estate Investment Trusts
PGRU,PropertyGuru Group Limited Ordinary Shares,$3.75,0.10,2.74%,614822381.00,,2022,40794,Technology,EDP Services
PGSS,Pegasus Digital Mobility Acquisition Corp. Class A Ordinary Shares,$10.99,-0.41,-3.596%,0.00,,2021,1991,Finance,Blank Checks
PGZ,Principal Real Estate Income Fund Common Shares of Beneficial Interest,$9.85,0.065,0.664%,0.00,,2013,22298,Finance,Investment Managers
PH,Parker-Hannifin Corporation Common Stock,$553.64,4.26,0.775%,71093385209.00,United States,,548739,Industrials,Metal Fabrications
PHD,Pioneer Floating Rate Fund Inc.,$9.55,0.0141,0.148%,0.00,United States,2004,66311,Finance,Investment Managers
PHG,Koninklijke Philips N.V. NY Registry Shares,$21.07,0.35,1.689%,19097914497.00,Netherlands,,923886,Health Care,Medical Electronics
PHI,PLDT Inc. Sponsored ADR,$23.79,0.49,2.103%,5139966887.00,Philippines,,30635,Telecommunications,Telecommunications Equipment
PHIN,PHINIA Inc. Common Stock,$38.85,0.53,1.383%,1793492224.00,United States,2023,436239,Consumer Discretionary,Auto Parts:O.E.M.
PHK,Pimco High Income Fund,$4.79,0.07,1.483%,0.00,United States,2003,380157,Finance,Finance/Investors Services
PHM,PulteGroup Inc. Common Stock,$113.80,2.44,2.191%,23936932459.00,United States,,1747065,Consumer Discretionary,Homebuilding
PHR,Phreesia Inc. Common Stock,$20.61,0.15,0.733%,1162145798.00,United States,2019,502316,Consumer Discretionary,Business Services
PHT,Pioneer High Income Fund Inc.,$7.345,0.035,0.479%,0.00,United States,,57654,Finance,Investment Managers
PHX,PHX Minerals Inc. Common Stock,$3.40,-0.06,-1.734%,127290006.00,United States,2003,24280,Energy,Oil & Gas Production
PHYT,Pyrophyte Acquisition Corp. Class A Ordinary Shares,$11.3591,0.0091,0.08%,0.00,,2021,221,Finance,Blank Checks
PII,Polaris Inc. Common Stock,$83.81,0.53,0.636%,4736398279.00,United States,,646794,Consumer Discretionary,Industrial Specialties
PIM,Putnam Master Intermediate Income Trust Common Stock,$3.10,0.02,0.649%,155785521.00,United States,1988,61163,Finance,Finance Companies
PINE,Alpine Income Property Trust Inc. Common Stock,$14.93,-0.02,-0.134%,203394958.00,United States,2019,48461,Real Estate,Real Estate Investment Trusts
PINS,Pinterest Inc. Class A Common Stock,$33.96,1.32,4.044%,23058274872.00,United States,2019,12884782,Technology,Computer Software: Programming Data Processing
PIPR,Piper Sandler Companies Common Stock,$197.16,5.13,2.671%,3486296881.00,United States,,153745,Finance,Investment Bankers/Brokers/Service
PJT,PJT Partners Inc. Class A Common Stock,$94.09,-1.21,-1.27%,2250387037.00,United States,2015,288866,Finance,Investment Managers
PK,Park Hotels & Resorts Inc. Common Stock ,$16.57,0.24,1.47%,3489351561.00,United States,2016,1528051,Consumer Discretionary,Hotels/Resorts
PKE,Park Aerospace Corp. Common Stock,$14.76,0.11,0.751%,298939608.00,United States,,63335,,
PKG,Packaging Corporation of America Common Stock,$172.85,1.60,0.934%,15491528969.00,United States,2000,497224,Consumer Discretionary,Containers/Packaging
PKST,Peakstone Realty Trust Common Shares,$13.88,-0.47,-3.275%,503926683.00,United States,2023,119536,Real Estate,Real Estate Investment Trusts
PKX,POSCO Holdings Inc. American Depositary Shares (Each representing 1/4th of a share of Common Stock),$71.60,0.56,0.788%,21723204293.00,South Korea,1994,92147,Industrials,Steel/Iron Ore
PL,Planet Labs PBC Class A Common Stock,$1.77,0.01,0.568%,514397727.00,United States,2021,585674,Technology,Radio And Television Broadcasting And Communications Equipment
PLD,Prologis Inc. Common Stock,$104.06,0.71,0.687%,96243116860.00,United States,,4037588,Real Estate,Real Estate Investment Trusts
PLNT,Planet Fitness Inc. Common Stock,$60.27,0.39,0.651%,5312614386.00,United States,2015,1903263,Consumer Discretionary,Hotels/Resorts
PLOW,Douglas Dynamics Inc. Common Stock,$22.38,0.15,0.675%,514381137.00,United States,2010,215629,Industrials,Construction/Ag Equipment/Trucks
PLTR,Palantir Technologies Inc. Class A Common Stock,$22.52,0.81,3.731%,49830746980.00,United States,2020,32877016,Technology,Computer Software: Prepackaged Software
PLYM,Plymouth Industrial REIT Inc. Common Stock,$20.76,0.11,0.533%,942131898.00,United States,2017,176526,Real Estate,Real Estate Investment Trusts
PM,Philip Morris International Inc Common Stock,$95.02,-1.07,-1.114%,147514425847.00,United States,,5389937,Health Care, Medicinal Chemicals and Botanical Products 
PMF,PIMCO Municipal Income Fund Common Stock,$8.90,0.00,0.00%,0.00,United States,2001,87510,Finance,Finance/Investors Services
PML,Pimco Municipal Income Fund II Common Shares of Beneficial Interest,$8.15,0.03,0.369%,0.00,United States,2002,120729,Finance,Investment Managers
PMM,Putnam Managed Municipal Income Trust Common Stock,$5.84,0.005,0.086%,284634645.00,United States,1989,78998,Finance,Investment Managers
PMO,Putnam Municipal Opportunities Trust Common Stock,$9.75,-0.005,-0.051%,331320278.00,United States,1993,53945,Finance,Finance Companies
PMT,PennyMac Mortgage Investment Trust Common Shares of Beneficial Interest,$14.10,-0.04,-0.283%,1221713747.00,United States,2009,730470,Real Estate,Real Estate Investment Trusts
PMT^A,PennyMac Mortgage Investment Trust 8.125% Series A Fixed-to-Floating Rate Cumulative Redeemable Preferred Shares of Beneficial Interest,$23.5025,0.1475,0.632%,,United States,,12268,,
PMT^B,PennyMac Mortgage Investment Trust 8.00% Series B Fixed-to-Floating Rate Cumulative Redeemable Preferred Shares of Beneficial Interest,$22.95,-0.10,-0.434%,,United States,,9881,,
PMT^C,PennyMac Mortgage Investment Trust 6.75% Series C Cumulative Redeemable Preferred Shares of Beneficial Interest,$18.80,-0.3474,-1.814%,,United States,,20403,,
PMTU,PennyMac Mortgage Investment Trust 8.50% Senior Notes due 2028,$25.50,0.1499,0.591%,0.00,United States,2023,1257,,
PMX,PIMCO Municipal Income Fund III Common Shares of Beneficial Interest,$7.52,0.01,0.133%,0.00,United States,2002,186399,Finance,Trusts Except Educational Religious and Charitable
PNC,PNC Financial Services Group Inc. (The) Common Stock,$156.11,-0.19,-0.122%,62101824364.00,United States,,979207,Finance,Major Banks
PNF,PIMCO New York Municipal Income Fund Common Stock,$7.49,0.02,0.268%,0.00,United States,2001,11642,Finance,Finance Companies
PNI,Pimco New York Municipal Income Fund II Common Shares of Beneficial Interest,$7.10,-0.01,-0.141%,0.00,United States,2002,13647,Finance,Trusts Except Educational Religious and Charitable
PNM,PNM Resources Inc. (Holding Co.) Common Stock,$36.32,0.00,0.00%,3276077947.00,United States,,499860,Utilities,Electric Utilities: Central
PNNT,PennantPark Investment Corporation Common Stock,$7.13,0.08,1.135%,465050685.00,United States,2022,350367,Finance,Finance: Consumer Services
PNR,Pentair plc. Ordinary Share,$79.96,0.76,0.96%,13275328855.00,Switzerland,,959329,Industrials,Industrial Machinery/Components
PNST,Pinstripes Holdings Inc. Class A Common Stock,$3.06,-0.10,-3.165%,122668625.00,,2022,30385,Consumer Discretionary,Restaurants
PNW,Pinnacle West Capital Corporation Common Stock,$73.69,-0.51,-0.687%,8358462674.00,United States,,864408,Utilities,Electric Utilities: Central
POR,Portland General Electric Co Common Stock,$42.80,-0.45,-1.04%,4329749265.00,United States,,1517939,Utilities,Electric Utilities: Central
POST,Post Holdings Inc. Common Stock,$105.38,-0.51,-0.482%,6394586753.00,United States,2012,461617,Consumer Staples,Packaged Foods
PPG,PPG Industries Inc. Common Stock,$130.16,0.93,0.72%,30522520000.00,United States,,1370842,Consumer Discretionary,Paints/Coatings
PPL,PPL Corporation Common Stock,$27.02,-0.28,-1.026%,19930044084.00,United States,,3467288,Utilities,Electric Utilities: Central
PPT,Putnam Premier Income Trust Common Stock,$3.45,0.03,0.877%,343372507.00,United States,1988,139665,Finance,Finance Companies
PR,Permian Resources Corporation Class A Common Stock,$17.38,0.05,0.289%,13414964462.00,United States,2022,5322958,Energy,Oil & Gas Production
PRA,ProAssurance Corporation Common Stock,$13.17,-0.48,-3.516%,671280879.00,United States,,300125,Finance,Property-Casualty Insurers
PRE^J,PartnerRe Ltd. 4.875% Fixed Rate Non-Cumulative Redeemable Preferred Shares Series J,$19.75,0.24,1.23%,,Bermuda,,774,,
PRG,PROG Holdings Inc. Common Stock,$34.02,-0.90,-2.577%,1486289982.00,United States,,338434,Consumer Discretionary,Diversified Commercial Services
PRGO,Perrigo Company plc Ordinary Shares,$31.94,0.67,2.143%,4328379092.00,United States,,946309,Health Care,Biotechnology: Pharmaceutical Preparations
PRH,Prudential Financial Inc. 5.950% Junior Subordinated Notes due 2062,$25.08,-0.13,-0.516%,9003720000.00,United States,2022,11886,Finance,Life Insurance
PRI,Primerica Inc. Common Stock,$213.46,-5.13,-2.347%,7438560585.00,United States,2010,313053,Finance,Life Insurance
PRIF^D,Priority Income Fund Inc. 7.00% Series D Term Preferred Stock due 2029,$22.41,0.01,0.045%,,,,1108,,
PRIF^F,Priority Income Fund Inc. 6.625% Series F Term Preferred Stock due 2027,$23.36,0.01,0.043%,,,,208,,
PRIF^G,Priority Income Fund Inc. 6.25% Series G Preferred Stock Due 2026,$23.50,-0.13,-0.55%,,,,1455,,
PRIF^H,Priority Income Fund Inc. 6.00% Series H Term Preferred Stock due 2026,$23.13,-0.27,-1.154%,,,,2258,,
PRIF^I,Priority Income Fund Inc. 6.125% Series I Term Preferred Stock due 2028,$22.05,-0.095,-0.429%,,,,5197,,
PRIF^J,Priority Income Fund Inc. 6.000% Series J Term Preferred Stock due 2028,$22.102,0.0178,0.081%,,,,4798,,
PRIF^K,Priority Income Fund Inc. 7.000% Series K Cumulative Preferred Stock,$20.75,0.12,0.582%,,,,369,,
PRIF^L,Priority Income Fund Inc. 6.375% Series L Term Preferred Stock Due 2029,$22.48,0.03,0.134%,,,,626,,
PRIM,Primoris Services Corporation Common Stock,$46.42,1.01,2.224%,2480540155.00,United States,,316798,Industrials,Water Sewer Pipeline Comm & Power Line Construction
PRKS,United Parks & Resorts Inc. Common Stock,$50.78,-0.34,-0.665%,3248400053.00,United States,2013,695059,Health Care,Biotechnology: Electromedical & Electrotherapeutic Apparatus
PRLB,Proto Labs Inc. Common stock,$31.37,-0.05,-0.159%,806897791.00,United States,2012,72641,Industrials,Office Equipment/Supplies/Services
PRM,Perimeter Solutions SA Ordinary Shares,$7.06,0.09,1.291%,1028879844.00,Luxembourg,2021,347898,Industrials,Major Chemicals
PRMW,Primo Water Corporation Common Stock,$18.95,0.10,0.531%,3022733602.00,Canada,,525202,Consumer Staples,Beverages (Production/Distribution)
PRO,PROS Holdings Inc. Common Stock,$33.98,0.05,0.147%,1588151463.00,United States,2007,165984,Technology,EDP Services
PRS,Prudential Financial Inc. 5.625% Junior Subordinated Notes due 2058,$24.32,-0.1342,-0.549%,8730880000.00,United States,2018,24395,Finance,Life Insurance
PRT,PermRock Royalty Trust Trust Units,$4.06,0.01,0.247%,49392872.00,United States,2018,27555,Energy,Oil & Gas Production
PRU,Prudential Financial Inc. Common Stock,$110.50,-0.68,-0.612%,39669500000.00,United States,2001,1110106,Finance,Life Insurance
PSA,Public Storage Common Stock,$257.73,-0.95,-0.367%,45280945553.00,United States,,577681,Real Estate,Real Estate Investment Trusts
PSA^F,Public Storage Depositary Shares Each Representing 1/1000 of a 5.15% Cumulative Preferred Share of Beneficial Interest Series F par value $0.01 per share,$23.00,-0.07,-0.303%,,United States,,18903,,
PSA^G,Public Storage Depositary Shares Each Representing 1/1000 of a 5.05% Cumulative Preferred Share of Beneficial Interest Series G,$23.01,-0.03,-0.13%,,United States,,15311,,
PSA^H,Public Storage Depositary Shares Each Representing 1/1000 of a  5.60% Cumulative Preferred  Share of Beneficial Interest Series H,$24.83,0.07,0.283%,,United States,,23350,,
PSA^I,Public Storage Depositary Shares Each Representing 1/1000 of a 4.875% Cumulative Preferred Share of Beneficial Interest Series I par value $0.01 per share,$21.72,-0.21,-0.958%,,United States,,13245,,
PSA^J,Public Storage Depositary Shares Each Representing 1/1000 of a 4.700% Cumulative Preferred Share of Beneficial Interest Series J par value $0.01 per share,$20.70,0.09,0.437%,,United States,,27971,,
PSA^K,Public Storage Depositary Shares Each Representing 1/1000 of a 4.75% Cumulative Preferred Share of Beneficial Interest Series K,$20.82,-0.01,-0.048%,,United States,,46854,,
PSA^L,Public Storage Depositary Shares Each Representing 1/1000 of a 4.625% Cumulative Preferred Share of Beneficial Interest Series L par value $0.01 per share,$20.56,-0.06,-0.291%,,United States,,38282,,
PSA^M,Public Storage Depositary Shares Each Representing 1/1000 of a 4.125% Cumulative Preferred Share of Beneficial Interest Series M,$18.26,0.08,0.44%,,United States,,6677,,
PSA^N,Public Storage Depositary Shares Each Representing 1/1000 of a 3.875% Cumulative Preferred Share of Beneficial Interest Series N,$16.86,-0.13,-0.765%,,United States,,11844,,
PSA^O,Public Storage Depositary Shares Each Representing 1/1000 of a 3.900% Cumulative Preferred Share of Beneficial Interest Series O,$16.975,-0.025,-0.147%,,United States,,11703,,
PSA^P,Public Storage Depositary Shares Each Representing 1/1000 of a 4.000% Cumulative Preferred Share of Bene cial Interest Series P,$17.74,-0.02,-0.113%,,United States,,50611,,
PSA^Q,Public Storage Depositary Shares Each Representing 1/1000 of a 3.950% Cumulative Preferred Share of Beneficial Interest Series Q par value $0.01 per share,$17.30,-0.01,-0.058%,,United States,,7179,,
PSA^R,Public Storage Depositary Shares Each Representing 1/1000 of a 4.00% Cumulative Preferred Share of Bene cial Interest Series R,$17.59,-0.07,-0.396%,,United States,,17960,,
PSA^S,Public Storage Depositary Shares Each Representing 1/1000 of a 4.100% Cumulative Preferred Share of Beneficial Interest Series S,$17.98,-0.05,-0.277%,,United States,,14157,,
PSBD,Palmer Square Capital BDC Inc. Common Stock,$16.43,-0.18,-1.084%,0.00,,2024,17092,,
PSEC^A,Prospect Capital Corporation 5.35% Series A Fixed Rate Cumulative Perpetual Preferred Stock,$17.525,0.255,1.477%,,United States,,2657,,
PSF,Cohen & Steers Select Preferred and Income Fund Inc. Common Stock,$18.84,0.06,0.319%,925771752.00,,2010,17437,Finance,Investment Managers
PSFE,Paysafe Limited Common Shares,$14.46,-0.04,-0.276%,892463146.00,,2021,227534,Consumer Discretionary,Business Services
PSN,Parsons Corporation Common Stock,$79.73,0.45,0.568%,8437792334.00,United States,2019,430153,Technology,EDP Services
PSO,Pearson Plc Common Stock,$12.38,-0.04,-0.322%,8499984881.00,United Kingdom,,988738,Consumer Discretionary,Books
PSQH,PSQ Holdings Inc. Class A Common Stock,$4.05,-0.25,-5.814%,114563375.00,,2021,42928,Consumer Discretionary,Advertising
PSTG,Pure Storage Inc. Class A Common Stock,$52.95,0.73,1.398%,17204000809.00,United States,2015,2272429,Technology,Electronic Components
PSTL,Postal Realty Trust Inc. Class A Common Stock,$13.73,-0.04,-0.29%,309087398.00,United States,2019,40600,Real Estate,Real Estate Investment Trusts
PSX,Phillips 66 Common Stock,$151.41,-5.83,-3.708%,64776896795.00,United States,,4206718,Energy,Integrated oil Companies
PTA,Cohen & Steers Tax-Advantaged Preferred Securities and Income Fund Common Shares of Beneficial Interest,$18.482,0.042,0.228%,1021564032.00,United States,2020,87492,Finance,Trusts Except Educational Religious and Charitable
PTY,Pimco Corporate & Income Opportunity Fund,$14.13,0.20,1.436%,0.00,United States,2002,894038,Finance,Investment Managers
PUK,Prudential Public Limited Company Common Stock,$18.31,0.16,0.882%,25208482521.00,United Kingdom,,964833,Finance,Life Insurance
PUMP,ProPetro Holding Corp. Common Stock,$8.98,0.24,2.746%,965952325.00,United States,2017,937430,Energy,Oilfield Services/Equipment
PVH,PVH Corp. Common Stock,$111.03,0.24,0.217%,6405199455.00,United States,,811773,Consumer Discretionary,Apparel
PVL,Permianville Royalty Trust Trust Units ,$1.63,-0.03,-1.807%,53790000.00,United States,2011,107625,Energy,Oil & Gas Production
PWR,Quanta Services Inc. Common Stock,$261.66,6.47,2.535%,38136677060.00,United States,,1179949,Industrials,Engineering & Construction
PWSC,PowerSchool Holdings Inc. Class A Common Stock,$17.57,0.19,1.093%,3559565247.00,United States,2021,601389,Technology,Computer Software: Prepackaged Software
PX,P10 Inc. Class A Common Stock,$7.46,0.06,0.811%,864443427.00,United States,2021,1111469,Finance,Investment Managers
PXD,Pioneer Natural Resources Company Common Stock,$268.87,-6.28,-2.282%,62814248543.00,United States,,2059137,Energy,Oil & Gas Production
PYN,PIMCO New York Municipal Income Fund III Common Shares of Beneficial Interest,$5.72,0.01,0.175%,0.00,United States,2002,14289,Finance,Investment Managers
PYT,PPlus Tr GSC-2 Tr Ctf Fltg Rate,$22.85,0.00,0.00%,0.00,United States,,100,Finance,Finance: Consumer Services
PZC,PIMCO California Municipal Income Fund III Common Shares of Beneficial Interest,$7.06,0.03,0.427%,0.00,United States,2002,44034,Finance,Investment Managers
QBTS,D-Wave Quantum Inc. Common Shares,$1.44,-0.04,-2.703%,232822259.00,,2022,3533646,Technology,EDP Services
QD,Qudian Inc. American Depositary Shares each representing one Class A Ordinary Share,$2.46,0.03,1.235%,571325962.00,China,2017,656734,Finance,Finance: Consumer Services
QGEN,Qiagen N.V. Common Shares,$41.65,0.57,1.388%,9504644746.00,Netherlands,,1406780,Health Care,Biotechnology: Biological Products (No Diagnostic Substances)
QS,QuantumScape Corporation Class A Common Stock,$5.39,0.29,5.686%,2672412785.00,United States,2020,8891864,Miscellaneous,Industrial Machinery/Components
QSR,Restaurant Brands International Inc. Common Shares,$73.82,0.75,1.026%,23052762729.00,Canada,2014,1306254,Consumer Discretionary,Restaurants
QTWO,Q2 Holdings Inc. Common Stock,$53.28,0.39,0.737%,3147473962.00,United States,2014,316768,Technology,EDP Services
QUAD,Quad Graphics Inc Class A Common Stock,$4.52,-0.07,-1.525%,236315241.00,United States,,96997,Consumer Discretionary,Publishing
QVCC,QVC Inc. 6.250% Senior Secured Notes due 2068,$12.20,-0.20,-1.613%,12.00,United States,2019,28850,Consumer Discretionary,Catalog/Specialty Distribution
QVCD,QVC Inc. 6.375% Senior Secured Notes due 2067,$12.48,0.08,0.645%,12.00,United States,2018,2851,Consumer Discretionary,Catalog/Specialty Distribution
R,Ryder System Inc. Common Stock,$121.95,-0.48,-0.392%,5344921306.00,United States,,224612,Consumer Discretionary,Rental/Leasing Companies
RA,Brookfield Real Assets Income Fund Inc. Common Stock,$12.51,0.03,0.24%,0.00,United States,2016,180880,Finance,Investment Managers
RACE,Ferrari N.V. Common Shares,$422.46,10.25,2.487%,76219426301.00,Italy,2015,217490,Consumer Discretionary,Auto Manufacturing
RAMP,LiveRamp Holdings Inc. Common Stock,$32.64,0.65,2.032%,2160236980.00,United States,2018,648474,Technology,EDP Services
RBA,RB Global Inc. Common Stock,$73.18,-0.15,-0.205%,13393167229.00,Canada,,456708,,
RBC,RBC Bearings Incorporated Common Stock,$245.03,0.78,0.319%,7150446103.00,United States,2022,130048,Industrials,Metal Fabrications
RBCP,RBC Bearings Incorporated 5.00% Series A Mandatory Convertible Preferred Stock,$112.37,0.21,0.187%,3279172463.00,United States,2022,2293,Industrials,Metal Fabrications
RBLX,Roblox Corporation Class A Common Stock,$36.01,0.48,1.351%,22745292482.00,United States,2021,3745401,Technology,Computer Software: Prepackaged Software
RBOT,Vicarious Surgical Inc. Class A Common Stock,$0.27,0.007,2.662%,47452952.00,Hong Kong,2020,334163,Health Care,Industrial Specialties
RBRK,Rubrik Inc. Class A Common Stock,$38.00,1.00,2.703%,0.00,,2024,5098071,,
RBT,Rubicon Technologies Inc. Class A Common Stock,$0.455,0.0629,16.042%,24323247.00,,2022,782543,Technology,Computer Software: Prepackaged Software
RC,Ready Capital Corproation Common Stock,$8.85,0.15,1.724%,1527107537.00,United States,2013,961578,Real Estate,Real Estate Investment Trusts
RC^C,Ready Capital Corporation 6.25% Series C Cumulative Convertible Preferred Stock,$17.75,0.01,0.056%,,United States,,3751,,
RC^E,Ready Capital Corporation 6.50% Series E Cumulative Redeemable Preferred Stock,$18.1763,-0.0737,-0.404%,,United States,,4897,,
RCB,Ready Capital Corporation 6.20% Senior Notes due 2026,$23.92,-0.15,-0.623%,4127504214.00,United States,2019,24508,Real Estate,Real Estate Investment Trusts
RCC,Ready Capital Corporation 5.75% Senior Notes due 2026,$24.18,-0.17,-0.698%,4172368390.00,United States,2021,10053,Real Estate,Real Estate Investment Trusts
RCFA,RCF Acquisition Corp. Class A Ordinary Shares,$11.20,0.00,0.00%,0.00,,2021,118,Finance,Blank Checks
RCI,Rogers Communication Inc. Common Stock,$37.96,-0.08,-0.21%,20166803039.00,Canada,,1265055,Telecommunications,Cable & Other Pay Television Services
RCL,Royal Caribbean Cruises Ltd. Common Stock,$140.59,3.12,2.27%,36082444167.00,United States,1993,2758440,Consumer Discretionary,Marine Transportation
RCS,PIMCO Strategic Income Fund Inc.,$5.69,-0.005,-0.088%,0.00,United States,1994,57879,Finance,Investment Managers
RCUS,Arcus Biosciences Inc. Common Stock,$15.55,0.82,5.567%,1412948091.00,United States,2018,505353,Health Care,Biotechnology: Pharmaceutical Preparations
RDDT,Reddit Inc. Class A Common Stock,$45.43,2.98,7.02%,7223056079.00,,2024,2760054,Technology,EDP Services
RDN,Radian Group Inc. Common Stock,$30.35,0.04,0.132%,4597967274.00,United States,,551740,Finance,Property-Casualty Insurers
RDW,Redwire Corporation Common Stock,$3.96,0.11,2.857%,259691747.00,United States,2021,66381,Industrials,Military/Government/Technical
RDY,Dr. Reddy's Laboratories Ltd Common Stock,$74.55,0.53,0.716%,12414653156.00,India,,216218,Health Care,Biotechnology: Pharmaceutical Preparations
RELX,RELX PLC PLC American Depositary Shares (Each representing One Ordinary Share),$41.61,0.49,1.192%,78352597016.00,United Kingdom,2015,873395,Consumer Discretionary,Business Services
RERE,ATRenew Inc. American Depositary Shares (every three of which representing two Class A ordinary shares),$1.98,0.37,22.981%,144860085.00,Cayman Islands,2021,3408310,Consumer Discretionary,Other Specialty Stores
RES,RPC Inc. Common Stock,$7.12,-0.24,-3.261%,1533971234.00,United States,,2146554,Energy,Oilfield Services/Equipment
REVG,REV Group Inc. Common Stock,$21.24,-0.51,-2.345%,1100236991.00,United States,2017,478109,Consumer Discretionary,Auto Manufacturing
REX,REX American Resources Corporation,$57.04,0.82,1.459%,998413615.00,United States,,164209,Industrials,Major Chemicals
REXR,Rexford Industrial Realty Inc. Common Stock,$43.20,0.20,0.465%,9409885776.00,United States,2013,1504812,Real Estate,Real Estate Investment Trusts
REXR^B,Rexford Industrial Realty Inc. 5.875% Series B Cumulative Redeemable Preferred Stock,$21.36,0.13,0.612%,,United States,,9023,,
REXR^C,Rexford Industrial Realty Inc. 5.625% Series C Cumulative Redeemable Preferred Stock par value $0.01 per share,$20.78,0.11,0.532%,,United States,,4385,,
REZI,Resideo Technologies Inc. Common Stock ,$19.88,0.08,0.404%,2888937386.00,United States,2018,541387,Industrials,Wholesale Distributors
RF,Regions Financial Corporation Common Stock,$19.62,0.01,0.051%,18028112622.00,United States,,5245526,Finance,Major Banks
RF^B,Regions Financial Corporation Depositary Shares Representing 1/40th Perpetual Preferred Series B,$24.75,-0.08,-0.322%,,United States,,19896,,
RF^C,Regions Financial Corporation Depositary Shares each Representing a 1/40th Interest in a  Share of 5.700% Fixed-to-Floating Rate Non-Cumulative  Perpetual Preferred Stock Series C,$21.94,0.13,0.596%,,United States,,28241,,
RF^E,Regions Financial Corporation Depositary Shares Each Representing a 1/40th Interest in a Share of 4.45% Non-Cumulative Perpetual Preferred Stock Series E,$17.416,-0.134,-0.764%,,United States,,17838,,
RFI,Cohen & Steers Total Return Realty Fund Inc. Common Stock,$11.14,0.12,1.089%,547404316.00,United States,1993,66002,Finance,Investment Managers
RFL,Rafael Holdings Inc. Class B Common Stock,$1.705,-0.005,-0.292%,41916468.00,United States,2018,15210,Health Care,Biotechnology: Pharmaceutical Preparations
RFM,RiverNorth Flexible Municipal Income Fund Inc. Common Stock,$15.9801,0.0301,0.189%,97713501.00,,2020,5020,Finance,Finance/Investors Services
RFMZ,RiverNorth Flexible Municipal Income Fund II Inc. Common Stock,$13.59,0.03,0.221%,330940364.00,,2021,57227,Finance,Trusts Except Educational Religious and Charitable
RGA,Reinsurance Group of America Incorporated Common Stock,$188.78,-2.28,-1.193%,12413619863.00,United States,,429874,Finance,Life Insurance
RGR,Sturm Ruger & Company Inc. Common Stock,$46.47,0.24,0.519%,820855374.00,United States,,86979,Industrials,Ordnance And Accessories
