Symbol,Name,Last Sale,Net Change,% Change,Market Cap,Country,IPO Year,Volume,Sector,Industry
KFS,Kingsway Financial Services Inc. Common Stock (DE),$8.58,0.05,0.586%,241280505.00,Canada,,14785,Finance,Property-Casualty Insurers
KFY,Korn Ferry Common Stock,$61.01,0.37,0.61%,3183516381.00,United States,1999,272334,Consumer Discretionary,Diversified Commercial Services
KGC,Kinross Gold Corporation Common Stock,$6.74,0.01,0.149%,8283343405.00,Canada,2001,14737130,,
KGS,Kodiak Gas Services Inc. Common Stock,$27.89,0.28,1.014%,2159650353.00,United States,2023,211536,Utilities,Natural Gas Distribution
KIM,Kimco Realty Corporation (HC) Common Stock,$18.38,-0.04,-0.217%,12367984342.00,United States,,2312018,Real Estate,Real Estate Investment Trusts
KIM^L,Kimco Realty Corporation Class L Depositary Shares each of which represents a one-one thousandth fractional interest in a share of 5.125% Class L Cumulative Redeemable Preferred Stock liquidation preference $25000.00 per share,$21.82,0.02,0.092%,,United States,,12638,,
KIM^M,Kimco Realty Corporation Class M Depositary Shares each of which represents a one-one thousandth fractional interest in a share of 5.25% Class M Cumulative Redeemable Preferred Stock liquidation preference $25000.00 per share,$22.47,0.05,0.223%,,United States,,41614,,
KIM^N,Kimco Realty Corporation Depositary Shares each representing 1/1000th interest in a share of 7.25% Class N Cumulative Convertible Perpetual Preferred Stock,$54.70,0.60,1.109%,,United States,,8157,,
KIND,Nextdoor Holdings Inc. Class A Common Stock,$2.02,0.02,1.00%,795134406.00,United States,,759896,Technology,Computer Software: Programming Data Processing
KIO,KKR Income Opportunities Fund Common Shares,$13.32,0.11,0.833%,0.00,,2013,89101,Finance,Investment Managers
KKR,KKR & Co. Inc. Common Stock,$95.54,0.67,0.706%,84553728905.00,United States,,1965876,Finance,Investment Managers
KKRS,KKR Group Finance Co. IX LLC 4.625% Subordinated Notes due 2061,$19.08,0.115,0.606%,16885965538.00,United States,2021,27948,,
KLG,WK Kellogg Co Common Stock,$23.94,-0.40,-1.643%,2054472889.00,United States,2023,891802,Consumer Staples,Packaged Foods
KMB,Kimberly-Clark Corporation Common Stock,$135.24,-1.19,-0.872%,45536535573.00,United States,,2123860,Consumer Discretionary,Containers/Packaging
KMI,Kinder Morgan Inc. Common Stock,$18.68,-0.12,-0.638%,41458102161.00,United States,2011,9415373,Utilities,Natural Gas Distribution
KMPB,Kemper Corporation 5.875% Fixed-Rate Reset Junior Subordinated Debentures due 2062,$22.06,-0.02,-0.091%,1418980668.00,United States,2022,3689,Finance,Property-Casualty Insurers
KMPR,Kemper Corporation,$57.43,-1.28,-2.18%,3694109689.00,United States,,635260,Finance,Property-Casualty Insurers
KMT,Kennametal Inc. Common Stock,$24.04,0.28,1.178%,1905645559.00,United States,,385272,Industrials,Industrial Machinery/Components
KMX,CarMax Inc,$69.59,0.37,0.535%,10952600300.00,United States,,2625796,Consumer Discretionary,Other Specialty Stores
KN,Knowles Corporation Common Stock,$16.03,0.14,0.881%,1436766736.00,United States,2014,341556,Consumer Staples,Consumer Electronics/Appliances
KNF,Knife Riv Holding Co. Common Stock,$78.25,0.63,0.812%,4427260270.00,United States,2023,142331,Industrials,Mining & Quarrying of Nonmetallic Minerals (No Fuels)
KNOP,KNOT Offshore Partners LP Common Units representing Limited Partner Interests,$4.99,-0.07,-1.383%,169884954.00,United Kingdom,2013,231631,Consumer Discretionary,Marine Transportation
KNSL,Kinsale Capital Group Inc. Common Stock,$374.64,-78.45,-17.314%,8687562551.00,United States,,803718,Finance,Property-Casualty Insurers
KNTK,Kinetik Holdings Inc. Class A Common Stock,$39.03,-0.17,-0.434%,5901576191.00,United States,2022,313889,Energy,Oil & Gas Production
KNX,Knight-Swift Transportation Holdings Inc.,$46.89,-0.25,-0.53%,7566592410.00,United States,2017,4211688,Industrials,Trucking Freight/Courier Services
KO,Coca-Cola Company (The) Common Stock,$61.74,0.00,0.00%,266251043812.00,United States,,10988415,Consumer Staples,Beverages (Production/Distribution)
KODK,Eastman Kodak Company Common New,$4.52,0.12,2.727%,361148000.00,United States,,356280,Consumer Discretionary,Industrial Machinery/Components
KOF,Coca Cola Femsa S.A.B. de C.V.  American Depositary Shares each representing 10 Units (each Unit consists of 3 Series B Shares and 5 Series L Shares),$99.61,0.94,0.953%,20926390142.00,Mexico,1993,127750,Consumer Staples,Beverages (Production/Distribution)
KOP,Koppers Holdings Inc. Common Stock,$52.73,-0.81,-1.513%,1108805913.00,United States,2006,76675,Basic Materials,Forest Products
KORE,KORE Group Holdings Inc. Common Stock,$0.7796,-0.0193,-2.416%,64860258.00,United States,,18983,Telecommunications,Telecommunications Equipment
KOS,Kosmos Energy Ltd. Common Shares (DE),$5.88,0.05,0.858%,2772434953.00,Bermuda,2011,2100751,Energy,Oil & Gas Production
KR,Kroger Company (The) Common Stock,$55.49,-0.42,-0.751%,40046458464.00,United States,,3470898,Consumer Staples,Food Chains
KRC,Kilroy Realty Corporation Common Stock,$33.14,-0.09,-0.271%,3888197227.00,United States,1997,799966,Real Estate,Real Estate Investment Trusts
KREF,KKR Real Estate Finance Trust Inc. Common Stock,$9.62,0.06,0.628%,666799333.00,United States,2017,580411,Real Estate,Real Estate Investment Trusts
KREF^A,KKR Real Estate Finance Trust Inc. 6.50% Series A Cumulative Redeemable Preferred Stock,$18.33,-0.05,-0.272%,,United States,,12373,,
KRG,Kite Realty Group Trust Common Stock,$21.26,-0.14,-0.654%,4665473601.00,United States,2004,850234,Real Estate,Real Estate Investment Trusts
KRO,Kronos Worldwide Inc Common Stock,$11.60,0.24,2.113%,1334313386.00,United States,,124813,Industrials,Major Chemicals
KRP,Kimbell Royalty Partners Common Units Representing Limited Partner Interests,$16.13,0.09,0.561%,1527490886.00,United States,2017,210741,Energy,Oil & Gas Production
KSM,DWS Strategic Municipal Income Trust,$9.53,0.01,0.105%,0.00,United States,1989,19204,Finance,Trusts Except Educational Religious and Charitable
KSS,Kohl's Corporation Common Stock,$24.53,0.25,1.03%,2720543240.00,United States,1992,3807999,Consumer Discretionary,Department/Specialty Retail Stores
KT,KT Corporation Common Stock,$12.59,0.08,0.639%,6447154632.00,South Korea,,346321,Telecommunications,Telecommunications Equipment
KTB,Kontoor Brands Inc. Common Stock ,$62.20,0.40,0.647%,3468249110.00,United States,2019,700170,Consumer Discretionary,Apparel
KTF,DWS Municipal Income Trust,$9.28,0.01,0.108%,366568705.00,United States,1988,56735,Finance,Finance Companies
KTH,Structures Products Cp 8% CorTS Issued by Peco Energy Cap Tr II Preferred Stock,$27.88,-0.61,-2.141%,0.00,United States,,7667,Finance,Finance: Consumer Services
KTN,Structured Products Corp 8.205% CorTS 8.205% Corporate Backed Trust Securities (CorTS),$26.98,0.03,0.111%,0.00,United States,,2083,Finance,Finance: Consumer Services
KUKE,Kuke Music Holding Limited American Depositary Shares each representing one Ordinary Share,$2.50,-0.14,-5.303%,54464063.00,,2021,14712,Real Estate,Other Consumer Services
KVUE,Kenvue Inc. Common Stock,$18.86,-0.16,-0.841%,36109013710.00,United States,2023,15451612,Consumer Discretionary,Specialty Chemicals
KVYO,Klaviyo Inc. Series A Common Stock,$23.61,0.59,2.563%,6167747230.00,United States,2023,611723,Technology,Computer Software: Prepackaged Software
KW,Kennedy-Wilson Holdings Inc. Common Stock,$8.50,0.04,0.473%,1181310433.00,United States,,538593,Finance,Real Estate
KWR,Quaker Houghton Common Stock,$190.23,2.80,1.494%,3422575929.00,United States,,33823,Industrials,Major Chemicals
KYN,Kayne Anderson Energy Infrastructure Fund Inc.,$9.76,-0.07,-0.712%,1328643733.00,United States,2004,361870,Finance,Finance/Investors Services
L,Loews Corporation Common Stock,$75.46,-0.95,-1.243%,16767297949.00,United States,,568947,Finance,Property-Casualty Insurers
LAAC,Lithium Americas (Argentina) Corp. Common Shares,$5.25,0.36,7.362%,839569500.00,Canada,2023,1267127,,
LAC,Lithium Americas Corp. Common Shares,$4.62,0.20,4.525%,742896000.00,Canada,2023,5354136,Basic Materials,Metal Mining
LAD,Lithia Motors Inc. Common Stock,$262.72,4.99,1.936%,7232927506.00,United States,,399224,Consumer Discretionary,Retail-Auto Dealers and Gas Stations
LADR,Ladder Capital Corp Class A Common Stock,$11.00,0.20,1.852%,1392789431.00,United States,2014,670686,Real Estate,Real Estate Investment Trusts
LANV,Lanvin Group Holdings Limited Ordinary Shares,$1.585,-0.015,-0.938%,207589146.00,Cayman Islands,1996,3476,Finance,Blank Checks
LAW,CS Disco Inc. Common Stock,$7.84,0.34,4.533%,478721125.00,United States,2021,178261,Technology,Computer Software: Prepackaged Software
LAZ,Lazard Inc. Common Stock,$38.99,0.10,0.257%,4396749888.00,Bermuda,2005,798552,Finance,Investment Managers
LBRT,Liberty Energy Inc. Class A common stock,$23.01,0.00,0.00%,3834655456.00,United States,2018,1960472,Energy,Oilfield Services/Equipment
LC,LendingClub Corporation Common Stock,$8.10,0.08,0.998%,894325876.00,United States,2014,548094,Finance,Finance: Consumer Services
LCII,LCI Industries,$107.32,0.58,0.543%,2718151807.00,United States,1995,155395,Consumer Discretionary,Auto Parts:O.E.M.
LCW,Learn CW Investment Corporation Class A Ordinary Shares,$10.95,0.01,0.091%,0.00,,2021,575,Finance,Blank Checks
LDI,loanDepot Inc. Class A Common Stock,$2.36,0.02,0.855%,762488749.00,United States,2021,186267,Finance,Finance: Consumer Services
LDOS,Leidos Holdings Inc. Common Stock,$130.36,0.48,0.37%,17700189678.00,United States,,891837,Technology,EDP Services
LDP,Cohen & Steers Limited Duration Preferred and Income Fund Inc.,$19.31,0.12,0.625%,0.00,United States,2012,29863,Finance,Finance Companies
LEA,Lear Corporation Common Stock,$136.47,2.99,2.24%,7783429707.00,United States,,711835,Consumer Discretionary,Auto Parts:O.E.M.
LEG,Leggett & Platt Incorporated Common Stock,$17.99,0.03,0.167%,2405804301.00,United States,,1510886,Consumer Discretionary,Home Furnishings
LEN,Lennar Corporation Class A Common Stock,$154.29,1.50,0.982%,42945629878.00,United States,,1348152,Consumer Discretionary,Homebuilding
LEO,BNY Mellon Strategic Municipals Inc. Common Stock,$5.85,0.01,0.171%,364401496.00,United States,1987,109561,Finance,Trusts Except Educational Religious and Charitable
LEV,The Lion Electric Company Common Shares,$0.9539,0.0409,4.48%,215787359.00,Canada,2021,366466,,
LEVI,Levi Strauss & Co Class A Common Stock,$21.13,0.04,0.19%,8410357672.00,United States,2019,1714033,Consumer Discretionary,Apparel
LFT,Lument Finance Trust Inc. Common Stock,$2.37,0.07,3.043%,123829255.00,United States,2013,42302,Real Estate,Real Estate Investment Trusts
LFT^A,Lument Finance Trust Inc. 7.875% Series A Cumulative Redeemable Preferred Stock,$20.17,0.42,2.127%,,United States,,4198,,
LGI,Lazard Global Total Return and Income Fund Common Stock,$15.56,0.24,1.567%,0.00,United States,2004,29486,,
LH,Laboratory Corporation of America Holdings Common Stock,$198.40,0.05,0.025%,16685440000.00,United States,,931293,Health Care,Medical Specialities
LHX,L3Harris Technologies Inc. Common Stock,$214.54,7.18,3.463%,40785739426.00,United States,,2133434,Industrials,Industrial Machinery/Components
LICY,Li-Cycle Holdings Corp. Common Shares,$0.6757,0.0183,2.784%,120982138.00,Canada,2021,2090100,Industrials,Environmental Services
LII,Lennox International Inc. Common Stock,$477.11,1.61,0.339%,16978762803.00,United States,1999,272027,Industrials,Industrial Machinery/Components
LITB,LightInTheBox Holding Co. Ltd. American Depositary Shares each representing 2 ordinary shares,$0.7252,0.0252,3.60%,80950660.00,China,2013,5482,Consumer Discretionary,Catalog/Specialty Distribution
LL,LL Flooring Holdings Inc. Common Stock,$1.50,-0.01,-0.662%,46258577.00,United States,2007,137062,Consumer Discretionary,RETAIL: Building Materials
LLAP,Terran Orbital Corporation Common Stock,$1.34,-0.04,-2.899%,269702871.00,United States,2021,1231331,Industrials,Military/Government/Technical
LLY,Eli Lilly and Company Common Stock,$733.51,8.64,1.192%,696955127187.00,United States,,2006305,Health Care,Biotechnology: Pharmaceutical Preparations
LMND,Lemonade Inc. Common Stock,$17.95,0.29,1.642%,1260528124.00,United States,2020,1148301,Finance,Property-Casualty Insurers
LMT,Lockheed Martin Corporation Common Stock,$461.29,-3.49,-0.751%,110681066446.00,United States,,857565,Industrials,Military/Government/Technical
LNC,Lincoln National Corporation Common Stock,$27.81,-0.15,-0.536%,4718488772.00,United States,,1515706,Finance,Life Insurance
LNC^D,Lincoln National Corporation Depositary Shares Each Representing a 1/1000th Interest in a Share of 9.000% Non-Cumulative Preferred Stock Series D,$27.05,-0.14,-0.515%,,United States,,12971,,
LND,Brasilagro Brazilian Agric Real Estate Co Sponsored ADR (Brazil),$4.95,0.13,2.697%,506766190.00,Brazil,,14964,Consumer Staples,Farming/Seeds/Milling
LNG,Cheniere Energy Inc. Common Stock,$159.14,-0.22,-0.138%,37348928484.00,United States,2001,1286920,Utilities,Oil/Gas Transmission
LNN,Lindsay Corporation Common Stock,$116.24,-1.16,-0.988%,1283089202.00,United States,,70363,Industrials,Industrial Machinery/Components
LOAR,Loar Holdings Inc. Common Stock,$49.71,0.91,1.865%,0.00,,2024,870297,,
LOB,Live Oak Bancshares Inc. Common Stock,$33.18,-1.10,-3.209%,1485443350.00,United States,2022,356577,Finance,Major Banks
LOCL,Local Bounti Corporation Common Stock,$2.95,-0.05,-1.667%,24890749.00,,2021,11450,Consumer Staples,Farming/Seeds/Milling
LOMA,Loma Negra Compania Industrial Argentina Sociedad Anonima ADS,$7.19,0.02,0.279%,839323442.00,Argentina,2017,359534,Industrials,Building Materials
LOW,Lowe's Companies Inc. Common Stock,$229.87,-0.09,-0.039%,131527991938.00,United States,,2001169,Consumer Discretionary,RETAIL: Building Materials
LPG,Dorian LPG Ltd. Common Stock,$41.78,0.50,1.211%,1695978841.00,United States,2014,570641,Consumer Discretionary,Marine Transportation
LPL,LG Display Co Ltd AMERICAN DEPOSITORY SHARES,$3.95,-0.01,-0.253%,2826744030.00,South Korea,2004,86748,Technology,Industrial Machinery/Components
LPX,Louisiana-Pacific Corporation Common Stock,$74.57,-0.25,-0.334%,5387803527.00,United States,,844087,Basic Materials,Forest Products
LRN,Stride Inc. Common Stock,$67.08,0.72,1.085%,2909474323.00,United States,,727557,Real Estate,Other Consumer Services
LSPD,Lightspeed Commerce Inc. Subordinate Voting Shares,$13.40,0.18,1.362%,2053392135.00,Canada,,480666,Technology,Computer Software: Prepackaged Software
LTC,LTC Properties Inc. Common Stock,$32.56,0.38,1.181%,1403749284.00,United States,,213296,Real Estate,Real Estate Investment Trusts
LTH,Life Time Group Holdings Inc. Common Stock,$14.15,0.04,0.283%,2783382018.00,United States,2021,441320,Consumer Discretionary,Hotels/Resorts
LU,Lufax Holding Ltd American Depositary Shares each representing two (2) Ordinary Shares,$4.68,0.10,2.183%,2682386862.00,China,,4757818,Finance,Finance: Consumer Services
LUMN,Lumen Technologies Inc. Common Stock,$1.21,0.00,0.00%,1221804543.00,United States,,6534716,Telecommunications,Telecommunications Equipment
LUV,Southwest Airlines Company Common Stock,$27.03,-0.23,-0.844%,16127842057.00,United States,,16105409,Consumer Discretionary,Air Freight/Delivery Services
LVS,Las Vegas Sands Corp. Common Stock,$45.45,-0.10,-0.22%,33862392968.00,United States,2004,4932125,Consumer Discretionary,Hotels/Resorts
LVWR,LiveWire Group Inc. Common Stock,$6.80,-0.28,-3.955%,1381505442.00,United States,2022,39678,Consumer Discretionary,Motor Vehicles
LW,Lamb Weston Holdings Inc. Common Stock ,$83.85,0.35,0.419%,12107187111.00,United States,2016,2462325,Consumer Staples,Packaged Foods
LXP,LXP Industrial Trust Common Stock (Maryland REIT),$8.48,0.03,0.355%,2495575545.00,United States,,1688443,Real Estate,Real Estate Investment Trusts
LXP^C,LXP Industrial Trust 6.5% Series C Cumulative Convertible Preferred Stock,$45.99,0.105,0.229%,,United States,,1976,,
LXU,LSB Industries Inc. Common Stock,$8.21,0.08,0.984%,599295313.00,United States,2003,279465,Industrials,Major Chemicals
LYB,LyondellBasell Industries NV Ordinary Shares Class A (Netherlands),$102.13,2.45,2.458%,33143548288.00,Netherlands,,2651714,Industrials,Major Chemicals
LYG,Lloyds Banking Group Plc American Depositary Shares,$2.61,0.09,3.571%,165915678978.00,United Kingdom,,10336836,Finance,Commercial Banks
LYV,Live Nation Entertainment Inc. Common Stock,$89.83,1.34,1.514%,20732557750.00,United States,,1889919,Consumer Discretionary,Services-Misc. Amusement & Recreation
LZB,La-Z-Boy Incorporated Common Stock,$33.11,-0.04,-0.121%,1411804904.00,United States,,201378,Consumer Discretionary,Home Furnishings
LZM,Lifezone Metals Limited Ordinary Shares,$8.26,0.06,0.732%,646509804.00,Isle of Man,,68736,Basic Materials,Metal Mining
M,Macy's Inc Common Stock,$18.43,0.08,0.436%,5054824408.00,United States,,3817022,Consumer Discretionary,Department/Specialty Retail Stores
MA,Mastercard Incorporated Common Stock,$462.42,0.31,0.067%,431387687430.00,United States,2006,1962819,Consumer Discretionary,Business Services
MAA,Mid-America Apartment Communities Inc. Common Stock,$129.23,2.03,1.596%,15083161253.00,United States,1994,874720,Real Estate,Real Estate Investment Trusts
MAA^I,Mid-America Apartment Communities Inc. 8.50% Series I Cumulative Redeemable Preferred Stock,$55.89,0.00,0.00%,,United States,,29,,
MAC,Macerich Company (The) Common Stock,$15.67,0.29,1.886%,3380333857.00,United States,1994,1111401,Real Estate,Real Estate Investment Trusts
MAIN,Main Street Capital Corporation Common Stock,$49.13,0.45,0.924%,4175074524.00,United States,2007,268072,Finance,Finance/Investors Services
MAN,ManpowerGroup Common Stock,$75.85,-0.34,-0.446%,3659044807.00,United States,,298062,Consumer Discretionary,Professional Services
MANU,Manchester United Ltd. Class A Ordinary Shares,$16.07,0.01,0.062%,2647451716.00,United Kingdom,2012,466004,Consumer Discretionary,Services-Misc. Amusement & Recreation
MAS,Masco Corporation Common Stock,$69.85,-0.02,-0.029%,15350580710.00,United States,,1921758,Consumer Discretionary,Building Products
MATV,Mativ Holdings Inc. Common Stock,$17.88,0.04,0.224%,970886003.00,United States,,184408,Basic Materials,Paper
MATX,Matson Inc. Common Stock,$108.94,-0.78,-0.711%,3757962865.00,United States,,171616,Consumer Discretionary,Marine Transportation
MAV,Pioneer Municipal High Income Advantage Fund Inc.,$7.84,0.03,0.384%,0.00,United States,,30839,Finance,Finance Companies
MAX,MediaAlpha Inc. Class A Common Stock,$18.86,0.45,2.444%,1234033997.00,United States,2020,182872,Consumer Discretionary,Business Services
MBC,MasterBrand Inc. Common Stock,$17.04,0.28,1.671%,2164126485.00,United States,2022,592342,Consumer Discretionary,Home Furnishings
MBI,MBIA Inc. Common Stock,$6.82,0.49,7.741%,347314713.00,United States,1987,663492,Finance,Property-Casualty Insurers
MC,Moelis & Company Class A Common Stock,$49.75,-0.51,-1.015%,3540449646.00,United States,2014,811587,Finance,Investment Bankers/Brokers/Service
MCB,Metropolitan Bank Holding Corp. Common Stock,$42.13,0.77,1.862%,467231348.00,United States,2017,67458,Finance,Major Banks
MCD,McDonald's Corporation Common Stock,$273.09,-2.51,-0.911%,197185040858.00,United States,,3635941,Consumer Discretionary,Restaurants
MCI,Barings Corporate Investors Common Stock,$17.79,0.09,0.508%,360455981.00,United States,,17970,Finance,Trusts Except Educational Religious and Charitable
MCK,McKesson Corporation Common Stock,$543.30,3.36,0.622%,71394121784.00,United States,,654668,Health Care,Other Pharmaceuticals
MCN,Madison Covered Call & Equity Strategy Fund Common Stock,$7.00,-0.01,-0.143%,0.00,United States,2004,93046,,
MCO,Moody's Corporation Common Stock,$376.13,0.95,0.253%,68643725000.00,United States,,718419,Finance,Finance: Consumer Services
MCR,MFS Charter Income Trust Common Stock,$6.15,0.055,0.902%,270651537.00,United States,1989,47577,Finance,Trusts Except Educational Religious and Charitable
MCS,Marcus Corporation (The) Common Stock,$13.35,-0.12,-0.891%,423494174.00,United States,,216996,Consumer Discretionary,Movies/Entertainment
MCW,Mister Car Wash Inc. Common Stock,$6.89,0.03,0.437%,2173603823.00,United States,2021,1375234,Consumer Discretionary,Automotive Aftermarket
MCY,Mercury General Corporation Common Stock,$51.66,-2.64,-4.862%,2860472421.00,United States,,392633,Finance,Property-Casualty Insurers
MD,Pediatrix Medical Group Inc. Common Stock,$9.04,0.14,1.573%,760471730.00,United States,,650180,Health Care,Hospital/Nursing Management
MDT,Medtronic plc. Ordinary Shares,$79.74,0.49,0.618%,105880569260.00,United States,,5024600,Health Care,Biotechnology: Electromedical & Electrotherapeutic Apparatus
MDU,MDU Resources Group Inc. Common Stock (Holding Company),$24.67,-0.13,-0.524%,5025009850.00,United States,,809867,Industrials,Mining & Quarrying of Nonmetallic Minerals (No Fuels)
MDV,Modiv Industrial Inc. Class C Common Stock,$15.00,0.00,0.00%,137591325.00,,2022,37494,Real Estate,Real Estate Investment Trusts
MDV^A,Modiv Industrial Inc. 7.375% Series A Cumulative Redeemable Perpetual Preferred Stock,$23.42,0.02,0.085%,,,,4594,,
MEC,Mayville Engineering Company Inc. Common Stock,$14.06,0.37,2.703%,286330592.00,United States,2019,48542,Industrials,Industrial Specialties
MED,MEDIFAST INC Common Stock,$33.71,0.21,0.627%,367290507.00,United States,,332426,Consumer Discretionary,Other Consumer Services
MEG,Montrose Environmental Group Inc. Common Stock,$43.11,1.95,4.738%,1309710856.00,United States,2020,352018,Consumer Discretionary,Professional Services
MEGI,MainStay CBRE Global Infrastructure Megatrends Term Fund Common Shares,$12.055,-0.055,-0.454%,0.00,United States,2021,102259,Finance,Investment Managers
MEI,Methode Electronics Inc. Common Stock,$12.22,0.09,0.742%,432471910.00,United States,,310120,Technology,Electrical Products
MER^K,Bank of America Corporation Income Capital Obligation Notes initially due December 15 2066,$25.28,-0.01,-0.04%,,United States,,29014,,
MET,MetLife Inc. Common Stock,$70.42,-1.48,-2.058%,50915090441.00,United States,2000,5650472,Finance,Life Insurance
MET^A,MetLife Inc. Preferred Series A Floating Rate,$24.05,-0.03,-0.125%,,United States,,11904,,
MET^E,MetLife Inc. Depositary shares each representing a 1/1000th interest in a share of the Issuera??s 5.625% Non-Cumulative Preferred Stock Series E.,$23.46,-0.27,-1.138%,,United States,,36624,,
MET^F,MetLife Inc. Depositary Shares each representing a 1/1000th interest in a share of 4.75% Non-Cumulative Preferred Stock Series F,$20.69,-0.14,-0.672%,,United States,,181350,,
MFA,MFA Financial Inc.,$10.73,0.19,1.803%,1095345214.00,United States,,472328,Real Estate,Real Estate Investment Trusts
MFA^B,MFA Financial Inc. Preferred Series B,$19.82,0.00,0.00%,,United States,,16101,,
MFA^C,MFA Financial Inc. 6.50% Series C Fixed-to-Floating Rate Cumulative Redeemable Preferred Stock,$22.00,0.03,0.137%,,United States,,35408,,
MFAN,MFA Financial Inc. 8.875% Senior Notes due 2029,$25.70,0.01,0.039%,0.00,United States,2024,16407,,
MFAO,MFA Financial Inc. 9.000% Senior Notes due 2029,$25.22,0.07,0.278%,0.00,United States,2024,62016,,
MFC,Manulife Financial Corporation Common Stock,$23.47,0.10,0.428%,42389589929.00,Canada,,1552889,Finance,Life Insurance
MFD,Macquarie First Trust Global Common Stock,$7.31,-0.06,-0.814%,62481801.00,United States,2004,20267,Finance,Trusts Except Educational Religious and Charitable
MFG,Mizuho Financial Group Inc. Sponosred ADR (Japan),$3.85,-0.04,-1.028%,48867376096.00,Japan,,599096,Finance,Major Banks
MFM,MFS Municipal Income Trust Common Stock,$5.08,0.015,0.296%,209233165.00,United States,1986,57073,Finance,Finance Companies
MG,Mistras Group Inc Common Stock,$8.95,0.13,1.474%,274181326.00,United States,2009,16710,Consumer Discretionary,Military/Government/Technical
MGA,Magna International Inc. Common Stock,$49.12,0.42,0.862%,14090876389.00,Canada,,1139240,Consumer Discretionary,Auto Parts:O.E.M.
MGF,MFS Government Markets Income Trust Common Stock,$3.10,0.05,1.639%,101051918.00,United States,1987,46416,Finance,Trusts Except Educational Religious and Charitable
MGM,MGM Resorts International Common Stock,$41.09,-1.09,-2.584%,13135580155.00,United States,,4681252,Consumer Discretionary,Hotels/Resorts
MGR,Affiliated Managers Group Inc. 5.875% Junior Subordinated Notes due 2059,$22.395,0.095,0.426%,734424474.00,United States,2019,9543,Finance,Investment Managers
MGRB,Affiliated Managers Group Inc. 4.750% Junior Subordinated Notes due 2060,$18.60,-0.01,-0.054%,609970762.00,United States,2020,7675,Finance,Investment Managers
MGRD,Affiliated Managers Group Inc. 4.200% Junior Subordinated Notes due 2061,$16.9745,0.1845,1.099%,556663909.00,United States,2021,2028,Finance,Investment Managers
MGRE,Affiliated Managers Group Inc. 6.750% Junior Subordinated Notes due 2064,$25.51,-0.06,-0.235%,,United States,2024,46145,,
MGY,Magnolia Oil & Gas Corporation Class A Common Stock,$26.34,0.06,0.228%,5380654889.00,United States,2017,1466177,Energy,Oil & Gas Production
MHD,Blackrock MuniHoldings Fund Inc. Common Stock,$11.46,0.03,0.262%,1704817918.00,United States,1997,85474,Finance,Investment Bankers/Brokers/Service
MHF,Western Asset Municipal High Income Fund Inc. Common Stock,$6.80,-0.02,-0.293%,0.00,United States,1988,34783,Finance,Finance/Investors Services
MHI,Pioneer Municipal High Income Fund Inc.,$8.52,0.00,0.00%,0.00,United States,2003,64828,Finance,Investment Managers
MHK,Mohawk Industries Inc. Common Stock,$115.45,5.18,4.698%,7353754691.00,United States,,1100161,Consumer Discretionary,Home Furnishings
MHLA,Maiden Holdings Ltd. 6.625% Notes due 2046,$16.15,0.0201,0.125%,1622624738.00,Bermuda,2016,1817,Finance,Property-Casualty Insurers
MHN,Blackrock MuniHoldings New York Quality Fund Inc. Common Stock,$10.22,0.02,0.196%,1520352454.00,United States,1997,10014,Finance,Investment Bankers/Brokers/Service
